"Coauthor","Paper","Journal","AuthorID","PaperID"
"Jung-HoonLee;Gi-HoPark;Shin-DugKim","Application-Specific Data Cache System for High Performance,","ISCA International Symposium Computer Architecture th International Conference Computers and Their Applications CATA","32","623"
"Jung-HoonLee;Shin-DugKim","Run-Time Adaptive Cache Memory Systems,","the Proc of SOC Design Conference","32","624"
"Jung-HoonLee;Jin-HyuckChoi;Shin-DugKim","Research Trends of Low Power On-Chip Memory Systems,","Journal of Korea Information Science Society special issue low power computing","32","625"
"Jung-HoonLee;Gi-HoPark;Shin-DugKim;CharlesWeems","A Selective Block Buffering TLB System for Embedded Processors,","conditional to the IEEE TRANSACTION COMPUTERS TOC","32","626"
"Jung-HoonLee;Gi-HoPark;Sung-BasPark;Shin-DugKim","A Selective Filter-Bank TLB System,","ACM IEEE International Symposium Low Power Electronics and Design ISLPED Seoul Korea","32","627"
"Jung-HoonLee;Jang-SooLee;Shin-DugKim","A Selective Temporal and Aggressive Spatial Cache System Based on Time Interval"," IEEE International Conference Computer Design ICCD International Conference Computer Design best paper award","32","628"
"Kil-WhanLee;Jang-SooLee;Gi-HoPark;Jung-HoonLee;Tack-DonHan;Shin-DugKim","The Cache Memory System for CalmRISC ,","ASIA PACIFIC CONFERENCE ASIC AP ASIC Cheju Korea","32","629"
"Jong-SungLee;Jung-HoonLee;Shin-DugKim","TLB system for supporting multiple page sizes regardless of operating system,","the Proc of Korea Information Science Society A","32","630"
"Jung-HeeMin;Jung-HoonLee;Shin-DugKim","A Selectively Accessing Dual-TLB for Low Power Embedded Systems,","conditional to the Journal of System Architecture","32","631"
"Jung-HiMin;Jung-HoonLee;Seh-WoongJeong;Shin-DugKim","A Selectively Accessing TLB for High Performance and Low Power Consumption"," IEEE ASIA PACIFIC CONFERENCE ASIC AP ASIC Taipei","32","632"
"Gi-HoPark;Kil-WhanLee;Jang-SooLee;Jung-HoonLee;Tack-DonHan;Shin-DugKim;Moon-KeyLee;Yong-ChunKim;Seh-WoongJung;Hyung-LaeRoh;Kwang-YupLee","Cooperative cache system: A Low-Power Cache Structure for Embedded Processors,","COOL Chips III International Symposium Low Power and High Speed Chips Tokyo","32","633"
"Jin-HyuckChoi;Jung-HoonLee;Seh-WoongJeong;Shin-DugKim;CharlesWeems","A Low power TLB structure for Embedded Systems"," IEEE Computer Society Technical Committee Computer Archotecture Letter TCCA latter paper","32","634"
"Jin-HyuckChoi;Jung-HoonLee;Gi-HoPark;Shin-DugKim","An Advanced Filtering TLB for Low Power Consumption,","The th Symposium Computer Architecture and High Performance Computing Vit ria","32","635"
"Jung-HoonLee;Jang-SooLee;Seh-woongJeong;Shin-DugKim","A Banked-Promotion TLB For High Performance and Low Power,","IEEE International Conference Computer Design ICCD International Conference Computer Design","32","636"
"Jung-HoonLee;Seh-WoongJeong;Shin-DugKim;CharlesWeems","A banked-Promotion translation lookaside buffer system,","Journal of System Architecture JSA Issue paper","32","637"
"Jung-HoonLee;Gi-HoPark;Shin-DugKim","Dual Cache Architecture for Low Cost and High Performance,","ETRI Journal","32","638"
"Jung-HoonLee;Jang-SooLee;Shin-DugKim","A dual cache system based on the locality detection mechanism,","Journal of Korea Information Science Society","32","639"
"Jung-HoonLee;Jang-SooLee;Gi-HoPark;Kil-WhanLee;Shin-DugKim","Dual TLB structure for supporting two page sizes,","IEE Electronics letters paper","32","640"
"Jung-HoonLee;Gi-HoPark;Shin-DugKim","Dynamic and Selective Low power TLB System,"," to the Microprocessor and Microsystems","32","641"
"Jung-HoonLee;Jang-SooLee;Shin-DugKim","A Dynamic TLB Management Structure to Support Different Page Sizes,","ASIA PACIFIC CONFERENCE ASIC AP ASIC Cheju Korea","32","642"
"Gi-HoPark;Shin-DugKim","An Adaptive Multi-Module Cache with Hardware Prefetching Mechanism for Multimedia Applications ","Euro PDP","32","643"
"Jung-WookPark;Cheong-GhilKim;Jung-HoonLee;Shin-DugKim","An Energy Efficient Cache Memory Architecture for Embedded Systems,","ACM Symposium Applied Computing SAC Selected Areas Cryptography Nicosia","32","644"
"Gi-HoPark;Shin-DugKim","Appliaction-Specific Data Cache Systems ","Computers and Their Applications","32","645"
"CharlesCWeems;Seh-WoongJeong;Shin-DugKim","An Intelligent Cache System with Hardware Prefetching for High Performance ","IEEE Trans Computers","32","646"
"CharlesCWeems;Shin-DugKim","Application-adaptive intelligent cache memory system ","ACM Trans Embedded Comput Syst","32","647"
"Jung-HoonLee;Shin-DugKim","A High Performance and Low Power Banked-Promotion TLB Structure,","Journal of Korea Information Science Society","32","648"
"ByungEuiMin;SanjayRanka;SunghoonKo","High-Performance External Computations Using User-Controllable I/O ","IPPS International Parallel Processing Symposium SPDP Symposium Parallel and Distributed Processing","33","649"
"Myung-JoonKim;Wan-SeokKim","BADA-III/Web: Integration of the Web and an OODBMS ","HICSS INTERNATIONAL CONFERENCE SYSTEM SCIENCES","33","650"
"YoungkiSong","User-Controllable Parallel I/O for Scientific Applications ","ICPADS International Conference Parallel and Distributed Systems","33","651"
"Myung-JoonKim","High-Performance External Stencil Computations Using User-Controllable I/O ","ICPADS International Conference Parallel and Distributed Systems","33","652"
"PBruceBerra;SanjayRanka;Sung-YongPark","I/O and memory-efficient matrix multiplication with user-controllable parallel I/O ","ICPADS International Conference Parallel and Distributed Systems","33","653"
"RamezElmasri","Implementation Options for Time-Series Data ","Temporal Databases Dagstuhl","34","654"
"RamezElmasri","An EER-Based Conceptual Model and Query Language for Time-Series Data ","ER International Conference Conceptual Modeling the Entity Relationship Approach","34","655"
"JonghoWon;RamezElmasri","Specification of Calendars and Time Series for Temporal Databases ","ER International Conference Conceptual Modeling the Entity Relationship Approach","34","656"
"JonghoWon;RamezElmasri","An Integrated Temporal Data Model Incorporating Time Series Concept ","Data Knowl Eng","34","657"
"RamezElmasri","A Temporal Algebra for an ER-Based Temporal Data Model ","ICDE International Conference Data Engineering","34","658"
"AditDSingh;HeeYongYoun","Adaptive Voting for Faulty VFF Node Scheme for Distributed Self-Diagnosis ","FTCS Symposium Fault Tolerant Computing","35","659"
"HeeYongYoun","PSIM: Periodically Shifted Interleaved Memory System ","ICPP International Conference Parallel Processing","35","660"
"AditDSingh;HeeYongYoun","Adaptive Unanimous Voting UV Scheme for Distributed Self-Diagnosis ","IEEE Trans Computers","35","661"
"HeeYongYoun","An Efficient Dictionary Machine Using Hexagonal Processor Arrays ","IEEE Trans Parallel Distrib Syst","35","662"
"Byeong-WheeYun;HoonChoi;Myung-KyoonYim;Yun-TaeLee","Formal Verification of an Industrial System-on-a-Chip ","ICCD International Conference Computer Design","35","663"
"Doo-HwanBae;Sang-YoonMin","Aspect-Oriented Design AOD Technique for Developing Distributed Object-Oriented Systems over the Internet ","ICSC International Computing Science Conferences","36","664"
"Doo-HwanBae;Sang-UkJeon","An Automated Refactoring Approach to Design Pattern-Based Program Transformations in Java Programs ","APSEC","36","665"
"Dong-KukRyu;Doo-HwanBae;JungyoonKim;Sang-IlLee","Developing a Common Operating Environment for Military Application ","FTDCS Future Trends Distributed Computing Systems","36","666"
"Doo-HwanBae;IkjuHan","Towards Coping with Role-Binding Anomaly ","Reflection","36","667"
"Doo-HwanBae","An enhanced role model for alleviating the role-binding anomal ","Softw Pract Exper","36","668"
"GKim;HKim;KKang","Form, the Missing Piece in Effective Real-Time System Specification and Simulation ","IEEE Real Time Technology and Applications Symposium","37","669"
"HyeJKim;KyoCKang","Co-development of real-time systems and their simulation environments ","APSEC","37","670"
"HyeJKim;KyoChulKang","A real world object modeling method for creating simulation environment of real-time systems ","OOPSLA Conference Object Oriented Programming Systems Languages and Applications","37","671"
"GerardJounghyunKim;KwanWLee;KyoChulKang","ASADAL/SIM: An Incremental Multi-Level Simulation and Analysis Tool for Real-Time Software Specifications ","Softw Pract Exper","37","672"
"GerardJounghyunKim;HyeJKim;KyoChulKang","Adding Form to Real-Time System Specification and Simulation ","International Journal of Software Engineering and Knowledge Engineering","37","673"
"","Comparison of variance between correlated samples ","Computer Applications the Biosciences","38","674"
"","Cumulative logit modelling for ordinal response variables: applications to biomedical research ","Computer Applications the Biosciences","38","675"
"CYoshizawa;HPLee;LWilkens","Covariance adjustment of survival curves based on Cox's proportional hazards regression model ","Computer Applications the Biosciences","38","676"
"KPFung","Basic program to assess the extent and pattern of agreement between two procedures ","Computer Applications the Biosciences","38","677"
"KPFung","BASIC program for polynomial regression and smoothing ","Computer Applications the Biosciences","38","678"
"JaehoLee","An Adaptable Dialog Interface Agent Using Meta-Rules ","FLAIRS The AI Research Society Conference Conference","39","679"
"EugeneSantos;RobertMcCartney","Learning and Predicting User Behavior for Particular Resource Use ","FLAIRS The AI Research Society Conference Conference","39","680"
"RobertMcCartney","Partial Plan Recognition Using Predictive Agents ","PRIMA International Workshop Multi Agents","39","681"
"RobertMcCartney","Predicting User Actions Using Interface Agents with Individual User Models ","PRIMA International Workshop Multi Agents","39","682"
"RobertMcCartney","Predicting Resource Use with Case-Based Plan Recognition ","AAAI National Conference Artificial Intelligence IAAI The Twelfth Innovative Applications of Artificial Intelligence","39","683"
"Kuo-HsunHsu;LeinFLai;Yong-YiFanjiang","Task-based conceptual graphs as a basis for automating software development ","Int J Intell Syst","3","684"
"Jong-YihKuo","Fuzzy Decision Making through Trade-Off Analysis between Criteria ","Inf Sci","3","685"
"John-YihKuo","New Approach to Requirements Trade-Off Analysis for Complex Systems ","IEEE Trans Knowl Data Eng","3","686"
"Jong-YihKuo;Nien-LinXue","A note on current approaches to extending fuzzy logic to object-oriented modeling ","Int J Intell Syst","3","687"
"JYKuo;NLXue","A note on current approaches to extending fuzzy logic to object-oriented modeling ","International Journal of Intelligent Systems SCI Scalable Coherent Interface EI","3","688"
"LFLai;SJHYang","Fuzzy logic as a basis for reusing task-based specifications ","International Journal of Intelligent Systems NSC E SCI Scalable Coherent Interface EI","3","689"
"NLXue;TLKuei","A note on state modeling through inheritance ","ACM Software Engineering Notes NSC E","3","690"
"LeinFLai;WeiTHuang","A Task-Based Approach to Verifying Conceptual Models ","COMPSAC International Computer Software and Applications Conference","3","691"
"","Interweave knowledge and data guest editor's introduction ","International Journal Artifical Intelligence Tools","3","692"
"LeinFLai;WeiTHuang","Task-Based Specifications Through Conceptual Graphs ","IEEE Expert","3","693"
"KHirota;LKoczy","Applications of fuzzy theory to complex systems guest editor's introduction ","International Journal of Fuzziness Uncertainty and Knowledge Based Systems","3","694"
"WTHuang;JYen","Acquiring task-based knowledge and specifications ","Encyclopedia of Computer Science and Technology","3","695"
"Hsiao-FanWang","Preface ","Fuzzy Sets and Systems","3","696"
"FRLiu;WLChiang","A possibilistic-logic-based approach to integrating imprecise and uncertain information ","Fuzzy Sets and Systems SCI Scalable Coherent Interface EI","3","697"
"JYKuo","Fuzzy decision making through trade-off analysis between criteria ","Information Sciences NSC E SCI Scalable Coherent Interface EI","3","698"
"Nien-LinXue","Analyzing User Requirements by Use Cases: A Goal-Driven Approach ","IEEE Software","3","699"
"JIPan","A rule-based approach to producing z specifications from Jackson system development ","International Journal of Intelligent Systems NSC E SCI Scalable Coherent Interface EI","3","700"
"KFRLiu;WLChiang","A fuzzy Petri net-based expert system and its application to damage assessment of bridges ","IEEE Transactions Systems Man and Cybernetics","3","701"
"StephenJHYang;WeiTHuang;WilliamCChu","A Fuzzy Petri Nets Based Mechanism for Fuzzy Rules Reasoning ","COMPSAC International Computer Software and Applications Conference","3","702"
"JYen","Specifying soft requirements of knowledge-based systems ","R Yager and L A Zadeh editors Fuzzy Sets Neural Networks and Soft Computing New Van Nostrand Reinhold pages","3","703"
"SJHYang;WChu","Specifying and verifying temporal behavior of high asurance systems using reachability tree logic ","International Journal of Software Engineering and Knowledge Engineering SCI Scalable Coherent Interface EI","3","704"
"JIPan;WTHuang","OOSZ: an integration of Bailin's Object-Oriented Analysis and Formal Specifications ","Journal of Information Science and Engineering EI NSC E","3","705"
"StephenJHYang;WilliamCChu","Specifying and Verifying Temporal Behavior of High Assurance Systems Using Reachability Tree Logic ","International Journal of Software Engineering and Knowledge Engineering","3","706"
"NLXue;JYKuo","Structuring requirement specifications with goals ","Information and Software Technology SCI Scalable Coherent Interface EI","3","707"
"","Guest Editor's Introduction: Interweave Knowledge and Data ","International Journal Artificial Intelligence Tools","3","708"
"JYen;DHamilton","Expert systems design methods supporting verification ","G H Schildt and J Retti editors Dependability of Artificial Intelligence Systems DAISY North pages","3","709"
"JYen;JPasstor","A tool for task-based knowledge and specification acquisition ","International Journal of Intelligent Systems","3","710"
"","Introduction: Extending fuzzy theory to object-oriented modeling ","Int J Intell Syst","3","711"
"JohnYen;JosettePastor","TAME: An Integrated Environment for Task-Based Knowledge and Specification Acquisition ","ICTAI International Conference Tools with Artificial Intelligence","3","712"
"Cheng-KaiChang;Jiann-IPan;WeiTHuang","Expressing JSD in Z ","COMPSAC International Computer Software and Applications Conference","3","713"
"JohnYen","A Task-Based Methodology for Specifying Expert Systems ","IEEE Expert","3","714"
"Tzung-JieChen;Ying-YanLin;Yong-YiFanjiang","An XML-based Approach to Processing Imprecise Requirements ","IFSA","3","715"
"WLChiang;FRLiu","Bridges damage assessment through a fuzzy petri net based expert system ","Journal of Computing Civil Engineering ASCE SCI Scalable Coherent Interface EI","3","716"
"WLChiang","Fuzzy Logic for the Applications to Complex Systems "," Editor World Scientific Publishing Pte Ltd","3","717"
"Kuo-HsunHsu;Nien-LinXue;StephenJHYang","Modeling Imprecise Requirements with Fuzzy Objects ","Inf Sci","3","718"
"Kuo-HsunHsu","Modeling software architectures with goals in virtual university environment ","Information amp Software Technology","3","719"
"Kuo-HsunHsu;Nien-LinXue;Yong-YiFangjang","Structuring Requirements Specifications through Goals Interactions ","ICTAI International Conference Tools with Artificial Intelligence","3","720"
"KFRLiu;WLChiang","Fuzzy petri nets for modeling rule-based reasonig ","International Journal Artificial Intelligence Tools","3","721"
"LFLai","A high-level Petri nets based approach to verifying task structures "," IEEE Transactions Knowldge and Data Engineering SCI Scalable Coherent Interface EI","3","722"
"LFLai","Verifying task-based specifications in conceptual graphs ","Information and Software Technology NSC E SCI Scalable Coherent Interface EI","3","723"
"NLXue;KHHsu;SJHYang","Modeling imprecise requirements with fuzzy objects ","Information Sciences NSC E SCI Scalable Coherent Interface EI","3","724"
"LFLai;KHHsu;YYFanjiang","Task-based conceptual graphs as a basis for automating software development","","3","725"
"JYKuo;ALiu","Modeling user requirements with a front-end analysis ","International Journal Artificial Intelligence Tools NSC E","3","726"
"LFLai;WTHuang","Task-based specifications through conceptual graphs ","IEEE Expert","3","727"
"JYen","Enhancing the software life cycle of knowledge-based system using a task-based specification methodology ","International Journal of Software Engineering and Knowledge Engineering","3","728"
"","Task structures as a basis for modeling knowledge-based systems ","International Journal of Intelligent Systems NSC E SCI Scalable Coherent Interface EI","3","729"
"NLXue","Analyzing user requirements by use cases: A goal-driven approach ","IEEE Software","3","730"
"SamLin;StephenJHYang;WilliamCChu","Specifying and Verifying Temporal Behavior of High Assurance Systems Using Reachability Tree Logic ","HASE","3","731"
"LFLai","A new approach to verifying conceptual models ","Journal of Information Science and Engineering EI NSC E","3","732"
"KevinFRLiu;WeilingChiang","Fuzzy Petri Nets for Modeling Rule-Based Reasoning ","International Journal Artificial Intelligence Tools","3","733"
"JYKuo","New approach to requirements trade-off analysis for complex systems ","IEEE Transactions Knowledge and Data Engineering NSC E and NSC E SCI Scalable Coherent Interface EI","3","734"
"FRLiu;WLChiang","High-level fuzzy petri nets as a basis for managing symbolic and numerical information ","International Journal of Artificial Intelligence Tools","3","735"
"JIPan;NLXue;WTHuang","An integrated combination of jsd and formal notations ","Proceedings of National Science Council Part A Physical Science and Engineering EI NSC E","3","736"
"KevinFRLiu;WeilingChiang","High-Level Petri Nets as a Basis for Managing Symbolic and Numerical Information ","International Journal Artificial Intelligence Tools","3","737"
"KevinFRLiu;WeilingChiang","Modeling uncertainty reasoning with possibilistic Petri nets ","IEEE Transactions Systems Man and Cybernetics Part B","3","738"
"Jiann-IPan;Jong-YihKuo","Verifying scenarios with time Petri-nets ","Information amp Software Technology","3","739"
"Jiann-IPan;Jong-YihKuo;StephenJHYang;Yong-YiFanjiang","Towards the Verification of Scenarios with Time Petri-Nets ","COMPSAC International Computer Software and Applications Conference","3","740"
"SangHyukSon;SavitaShamsunder","Real-Time Transaction Processing: Pessimistic, Optimistic, and Hybrid Approaches ","RIDE Research Issues Data Engineering TQP","40","741"
"SangHyukSon","Using Dynamic Adjustment of Serialization Order for Real-Time Database Systems ","IEEE Real Time Systems Symposium","40","742"
"SangHyukSon","An Optimistic Concurrency Control Protocol for Real-Time Database Systems ","DASFAA Database Systems for Advanced Applications","40","743"
"SangHyukSon","Performance of Concurrency Control Algorithms for Real-Time Database Systems ","Performance of Concurrency Control Mechanisms Centralized Database Systems","40","744"
"SangHyukSon;YiLin","Hybrid Protocols Using Dynamic Adjustment of serialization Order for Real-Time Concurrency Control ","Real Time Systems","40","745"
"WonKim","Visual Tracking using Snake for Object's Discrete Motion ","ICRA International Conference Robotics and Automation","41","746"
"Cheol-TaekKim;Sang-KeonOh","Balancing the Selection Pressures and Migration Schemes in Parallel Genetic Algorithms for Planning Multiple Paths ","ICRA International Conference Robotics and Automation","41","747"
"Chang-HyunKim;Choon-YoungLee;Kap-HoSeo;Sang-KeonOh","A System for Gait Rehabilitation: Mobile Manipulator Approach ","ICRA International Conference Robotics and Automation","41","748"
"Jin-HoShin","Fault Detection and Robust Fault Recovery Control for Robot Manipulators with Actuator Failures ","ICRA International Conference Robotics and Automation","41","749"
"Chang-HyunKim;Min-SoengKim","Evolutionary Optimization of Fuzzy Models with Asymmetric RBF Membership Functions Using Simplified Fitness Farrugia ","IFSA","41","750"
"DonaldTTang","HIMALAYAS - a hierarchical compaction system with a minimized constraint set ","ICCAD International Conference Computer Aided Design","42","751"
"CKWong;DanielLOstapko;JefferySoreff","On the Signal Bounding Problem in Timing Analysis ","ICCAD International Conference Computer Aided Design","42","752"
"DonaldTTang","An Algorithm for Incremental Timing Analysis ","DAC Design Automation Conference","42","753"
"","A Layout Compaction Algorithm with Multiple Grid Constraints ","ICCD International Conference Computer Design","42","754"
"Shin-DugKim;Won-KeeHong","A Selective Compressed Memory System by On-Line Data Decompressing ","EUROMICRO","43","755"
"Jung-HoonLee;Seh-WoongJeong;Shin-DugKim","A Banked-Promotion TLB for High Performance and Low Power ","ICCD International Conference Computer Design","43","756"
"JHLee;SWJeong;SDKim;CWeems","A Banked-Promotion Translation lookaside buffer system,","Journal of System Architecture Issue ESCI","43","757"
"JHLee;JSLee;GHPark;KWLee;SDKim","Dual TLB structure for supporting two page sizes"," Electronics Letter SCI Scalable Coherent Interface paper","43","758"
"Jang-SooLee;WKHong;SDKim","Adaptive methods to minimize decompression overhead for compressed on-chip cache"," International Journal of Computers and Applications paper","43","759"
"NKLee;SBYang;TDHan;SDKim","Modeling and Performance Analysis of Dual Head Disk Structure"," Journal of Systems Architecture ESCI","43","760"
"JHLee;JSLee;SDKim","A new cache architecture based on temporal and spatial locality,","Journal of Systems Architecture ESCI","43","761"
"JSLee;WKHong;SDKim","An on-chip cache compression technique to reduce decompression overhead and design complexity,","Journal of Systems Architecture ESCI paper","43","762"
"Jung-HoonLee;Seh-WoongJeong;Shin-DugKim;CharlesWeems","An intelligent Cache System with Hardware prefetching for High Performance"," IEEE TRANSACTION COMPUTERS SCI Scalable Coherent Interface paper","43","763"
"Jung-HoonLee;Shin-DugKim;CharlesWeems","Application Adaptive Intelligent Cache Memory System,","ACM Transactions Embedded Computing Systems paper","43","764"
"Jang-SooLee;WKHong;SDKim","Performance analysis of a selectively compressed memory system,","Microprocessors and Microsystems ESCI","43","765"
"Young-MinLee;Byung-ChulTak;Hye-SeonMaeng;Shin-DugKim","Real-Time JAVA Virtual Machine for Information Appliances,","IEEE TRANSCATION CONSUNMER ELECTRONICS SCI Scalable Coherent Interface","43","766"
"Jung-HoonLee;Gi-HoPark;Shin-DugKim;CharlesWeems","A Selective Block Buffering TLB System for Embedded Processors,"," to the IEEE TRANSACTION COMPUTERS","43","767"
"Jung-HoonLee;Shin-DugKim","A Selective Temporal and Aggressive Spatial Cache System Based on Time Interval ","ICCD International Conference Computer Design","43","768"
"HSMaeng;TDHan;SDKim","Resource management method for cooperative Web computing on computational Grid,","Lecture Notes Computer Science ESCI","43","769"
"Kyung-LangPark;Hwang-JikLee;Oh-YoungKwon;Sung-YongPark;Hyoung-WooPark;Shin-DugKim","Design and Implementation of a Dynamic Communication MPI Library for the Grid,","International Journal of Computer and Applications to be appeared","43","770"
"WCPark;SHLee;OYKwon;TDHan;SDKim","Floating point adder/subtractor performing IEEE routing and addition/subtraction in parallel"," IEICE Trans Information Systems ESCI","43","771"
"WCPark;TDHan;SDKim;SBYang","A Floating Point Multiplier Performing IEEE Rounding and Addition in Parallel"," Journal of Systems Architecture ESCI","43","772"
"GHPark;OYKwon;TDHan;SDKim;SBYang","Methods to Improve the Performance of Instruction prefetching Through Balanced Improvement by Two Primary Performance Factors"," Journal of Systems Architecture ESCI","43","773"
"Kyung-LangPark;Hwang-JikLee;Yoon-JooLee;Oh-YoungKwon;Sung-YongPark;Hyung-WooPark;Shin-DugKim","An Efficient Collective Communication Method for Grid Scale Networks,","Lecture Notes Computer Science ESCI","43","774"
"GHPark;OYKwon;TDHan;SDKim","Non_referenced prefetch NPR cache for instruction prefetching"," IEE Proceedings Computers Digital Techniques paper","43","775"
"PSShin;WKHong;HCKim;SDKim","Configuration method of multiple clusters for the computational Grid,","Lecture Notes Computer Science ESCI paper","43","776"
"TBBerg;SDKim;HJSiegel","Limitations imposed on mixed-mode performance of optimized phaxes due to temporal juxtaposition"," Journal of Parallel and Distributed Computing","43","777"
"MCWang;JBArmstrong;SDKim;WGNation;HJSiegel","Multiple quadratic forms: A case study in the design of data-parallel algorithms"," Journal of Parallel and Distributed Computing paper","43","778"
"Jin-HyuckChoi;Jung-HoonLee;Se-WoongJeong;Shin-DugKim;CWeems","A Low Power TLB structure for Embedded Systems"," IEEE Computer Society Technical Committee Computer Architecture","43","779"
"Chun-MokChung;Pil-SupShin;Sang-KyumRoh;Won-KeeHong;Maeng-HyeSeon;Shin-DugKim","Design and Evaluation of A Scalable Java-Internet Computing Environment"," International Journal of Parallel and Distributed Systems and Networks ESCI paper","43","780"
"CMChung;PSShin;SDKim","An effective configuration method for Java-Internet computing environment,'' Parallel Processing Letters, , , July paper ","","43","781"
"WKHong;SDKim","A section cache for VLIW architecture,","Journal of Systems Architecture ESCI paper","43","782"
"Shin-DugKim;Won-KeeHong","Design and Evaluation of a Selective Compressed Memory System ","ICCD International Conference Computer Design","43","783"
