"Coauthor","Paper","Journal","AuthorID","PaperID"
"SeokWonLee;DavidCRine"," Missing Requirements and Relationship Discovery through Proxy Viewpoints Model, "," Proceedings of the th annual ACM Symposium Applied Computing SAC Selected Areas Cryptography","28","604"
"SeokWonLee"," A Methodological Knowledge Discovery Framework for Constructive Induction-based Multistrategy Learning, ","Korean American Scientists and Engineers Association KSEA Letters Volume","28","605"
"SeokWonLee;LKerschberg"," A Methodology and Life Cycle Model for Data Mining and Knowledge Discovery in Precision Agriculture, ","Proceedings of the IEEE International Conference Systems Man and Cybernetics SMC Intelligent Systems for Man a Cyberworld San Diego Computer Animation IEEE Computer Society Press","28","606"
"SeokWonLee;GTecuci;","A Methodology to Build a Knowledge Base from Shared Ontology Repositories,"," Technical Report Learning Agents Laboratory Department of Computer Science School of Information Technology and Engineering George University","28","607"
"SeokWonLee;","eXtended Memex Query XMQ Client Software: Version - User's Guide"," Technical Report Technology Development Division Information Systems Solutions Group ISSG Science Applications International Corporation","28","608"
"SeokWonLee;","An Empirical Study of a Two-Stage Knowledge Exploration and Discovery Methodology"," Technical Report Department of Computer Science School of Information Technology and Engineering George University","28","609"
"SeokWonLee"," An Empirical Study of a Two-Stage Knowledge Exploration and Discovery Methodology in Precision Agriculture, ","progress","28","610"
"SeokWonLee;","WWW-AQ: World Wide Web Interface for the AQ Learning System User's and Programmer's Guide,"," Reports of the Machine Learning and Inference Laboratory MLI George University","28","611"
"SeokWonLee;RyszardSMichalski;","Natural Induction: AQ-MOR: Learning from Examples an Extended Set of Multiple Operators"," Technical Report Machine Learning and Inference Laboratory George University","28","612"
"SeokWonLee;DavidCRine"," PVRD: The Integrated Framework for Missing Requirements and Relationships Discovery, "," to a journal","28","613"
"SumanBanerjee;SeungjoonLee;BobbyBhattacharjee;AravindSrinivasan"," Resilient Multicast using Overlays, ","Sigmetrics","29","614"
"BohyungHan;MinhoShin","Robust Routing in Wireless Ad Hoc Networks ","ICPP International Conference Parallel Processing Workshops","29","615"
"ChongkwonKim","Neighbor supporting ad hoc multicast routing protocol ","MobiHoc","29","616"
"ChongkwonKim","A new wireless ad hoc multicast routing protocol ","Computer Networks","29","617"
"SeungjoonLee;RobSherwood;BobbyBhattacharjee"," Cooperative Peer Groups in NICE, ","IEEE Infocom","29","618"
"SeungjoonLee;ChongkwonKim"," Neighbor Supporting Ad hoc Multicast Routing Protocol, ","MobiHOC","29","619"
"SeungjoonLee;ChongkwonKim"," A New Wireless Ad hoc Multicast Routing Protocol , ","Computer Networks Elsevier Science","29","620"
"SeungjoonLee;MinhoShin;BohyungHan"," Robust Routing in Wireless Ad hoc Networks, "," st International Workshop Ad Hoc Networking","29","621"
"SeungjoonLee;SumanBanerjee;BobbyBhattacharjee"," The Case for a Multi-hop Wireless Local Area Network, "," Infocom","29","622"
"HyojunLim;SeungjunLee;ChongkwonKim"," New User Tracking Algorithms for a Wireless Network and Performance Analysis, ","ICOIN International Conference Information Networking","29","623"
"HyojunLim;SeungjunLee;ChongkwonKim"," Performance analysis of user location update and paging in PCS Networks, ","JCCI Pusan Korea","29","624"
"HyojunLim;SeungjunLee;ChongkwonKim"," A study on the Performance Improvement Methods of User Tracking in PCS Networks, ","The Journal of the Korean Institute of Communication Sciences","29","625"
"RobSherwood;SamratBhattacharjee","Cooperative Peer Groups in NICE ","INFOCOM The Conference Computer Communications","29","626"
"AravindSrinivasan;BobbyBhattacharjee;SumanBanerjee","Resilient multicast using overlays ","SIGMETRICS Measurement and Modeling of Computer Systems","29","627"
"DongHoonLee;Dong-GukHan;Hye-YoungPark;Hyung-JinYang;Young-HoPark","A Practical Approach Defeating Blackmailing ","ACISP Australasian Conference Information Security and Privacy","2","628"
"HeajoungYoo;JongInLim;MaengheeSung;OkyeonYi;SeokhieHong","A Proposal of a New Public Key Cryptosystem Using Matrices over a Ring ","ACISP Australasian Conference Information Security and Privacy","2","629"
"DeukjoHong;JaechulSung","Key Recovery Attacks on the RMAC, TMAC, and IACBC ","ACISP Australasian Conference Information Security and Privacy","2","630"
"ChanghoonLee;DeukjoHong;Hyung-JinYang;JonginLim;SungjaeLee","A Chosen Plaintext Linear Attack on Block Cipher CIKS- ","ICICS International Conference Information Communications and Signal Processing","2","631"
"ChoonsikPark;JongInLim;Ju-SungKang","On the Optimal Diffusion Layers with Practical Security against Differential and Linear Cryptanalysis ","ICISC Information Security and Cryptology","2","632"
"JonginLim;SeokhieHong;SeonheeLee;SeonheeYoon","Truncated Differential Cryptanalysis of Camellia ","ICISC Information Security and Cryptology","2","633"
"DongHyeonCheon;KyungHwanPark;SeokHieHong;SeonheeYoon;SungJaeLee","Difference Distribution Attack on DONUT and Improved DONUT ","ICISC Information Security and Cryptology","2","634"
"HyejoungYoo;JonginLim;KwangsooLee","Off-Line Authentication Using Watermarks ","ICISC Information Security and Cryptology","2","635"
"JaechulSung;JongInLim;OkyeonYi;WonilLee","Concrete Security Analysis of CTR-OFB and CTR-CFB Modes of Operation ","ICISC Information Security and Cryptology","2","636"
"DonghoonChang;JaechulSung;JonginLim;SooHakSung","Full-Round Differential Attack on the Original Version of the Hash Function Proposed at PKC' ","Selected Areas Cryptography","2","637"
"ChoonsikPark;JaeWooHan;Ju-SungKang;JungHeeCheon;KiHyoungKo","New Public-Key Cryptosystem Using Braid Groups ","CRYPTO International Crytology Conference","2","638"
"DeukjoHong;JonginLim;SeokhieHong;YoungdaiKo","Linear Cryptanalysis of SPECTR-H with Higher Order Differential Property ","MMM Multimedia Modeling link ACNS Applied Cryptography and Network Security","2","639"
"DongHyeonCheon;JongInLim;SungJaeLee","New Block Cipher DONUT Using Pairwise Perfect Decorrelation ","INDOCRYPT International Cryptology Conference","2","640"
"DukjaeMoon;JongsungKim;SeokhieHong;SeokwonJung;WonilLee","Amplified Boomerang Attack against Reduced-Round SHACAL ","ASIACRYPT Theory and Application of Cryptology and Information Security","2","641"
"DaikiLee;SeongtaekChee;SooHakSung","On the Correlation Immune Functions and Their Nonlinearity ","ASIACRYPT Theory and Application of Cryptology and Information Security","2","642"
"JaeChoonCha;JaeWooHan;JungHeeCheon;KiHyoungKo","An Efficient Implementation of Braid Groups ","ASIACRYPT Theory and Application of Cryptology and Information Security","2","643"
"DeukjoHong;JaechulSung;JonginLim;OkyeonYi;SeokhieHong;WonilLee","Known-IV Attacks on Triple Modes of Operation of Block Ciphers ","ASIACRYPT Theory and Application of Cryptology and Information Security","2","644"
"JaechulSung;JongInLim;SangjoonPark;SeokhieHong","Provable Security for the Skipjack-like Structure against Differential Cryptanalysis and Linear Cryptanalysis ","ASIACRYPT Theory and Application of Cryptology and Information Security","2","645"
"DongHoonLee;Dong-GukHan;Hye-YoungPark;Hyung-JinYang;Young-HoPark","A Practical Approach Defeating Blackmailing ","ACISP Australasian Conference Information Security and Privacy","2","646"
"Sang-JoonPark;SeongtaekChee;Sung-MoPark","Conditional Correlation Attack on Nonlinear Filter Generators ","ASIACRYPT Theory and Application of Cryptology and Information Security","2","647"
"HeajoungYoo;JongInLim;MaengheeSung;OkyeonYi;SeokhieHong","A Proposal of a New Public Key Cryptosystem Using Matrices over a Ring ","ACISP Australasian Conference Information Security and Privacy","2","648"
"KilsooChun;SeonheeYoon;SeungjooKim;SooHakSung","Differential and linear cryptanalysis for -round SPNs ","Inf Process Lett","2","649"
"DeukjoHong;JaechulSung","Key Recovery Attacks on the RMAC, TMAC, and IACBC ","ACISP Australasian Conference Information Security and Privacy","2","650"
"ChanghoonLee;DeukjoHong;Hyung-JinYang;JonginLim;SungjaeLee","A Chosen Plaintext Linear Attack on Block Cipher CIKS- ","ICICS International Conference Information Communications and Signal Processing","2","651"
"ChoonsikPark;JongInLim;Ju-SungKang","On the Optimal Diffusion Layers with Practical Security against Differential and Linear Cryptanalysis ","ICISC Information Security and Cryptology","2","652"
"JonginLim;SeokhieHong;SeonheeLee;SeonheeYoon","Truncated Differential Cryptanalysis of Camellia ","ICISC Information Security and Cryptology","2","653"
"DongHyeonCheon;KyungHwanPark;SeokHieHong;SeonheeYoon;SungJaeLee","Difference Distribution Attack on DONUT and Improved DONUT ","ICISC Information Security and Cryptology","2","654"
"HyejoungYoo;JonginLim;KwangsooLee","Off-Line Authentication Using Watermarks ","ICISC Information Security and Cryptology","2","655"
"JaechulSung;JongInLim;OkyeonYi;WonilLee","Concrete Security Analysis of CTR-OFB and CTR-CFB Modes of Operation ","ICISC Information Security and Cryptology","2","656"
"JaechulSung;JonginLim;JongsuKim;SeokhieHong","Provable security for round Skipjack-like structure ","Inf Process Lett","2","657"
"KwangjoKim;SooHakSung;Sung-MoPark","Improving Bounds for the Number of Correlation Immune Boolean Functions ","Inf Process Lett","2","658"
"DaeHyunRyu;KyungHyuneRhee;SangUkShin","A New Hash Function Based on MDx-Family and Its Application to MAC ","Public Key Cryptography","2","659"
"JonginLim;MaengheeSung;SanghoOh;Young-HoPark","An Improved Method of Multiplication on Certain Elliptic Curves ","Public Key Cryptography","2","660"
"Sang-JoonPark;Seung-CheolGoh","On the Security of the Gollmann Cascades ","CRYPTO International Crytology Conference","2","661"
"EonkyungLee;SangGeunHahn","Pseudorandomness from Braid Groups ","CRYPTO International Crytology Conference","2","662"
"ChoonsikPark;JaeWooHan;Ju-SungKang;JungHeeCheon;KiHyoungKo","New Public-Key Cryptosystem Using Braid Groups ","CRYPTO International Crytology Conference","2","663"
"EonkyungLee","Potential Weaknesses of the Commutator Key Agreement Protocol Based on Braid Groups ","EUROCRYPT Theory and Application of Cryptographic Techniques","2","664"
"JaeChoonCha;JaeWooHan;JungHeeCheon;KiHyoungKo","An Efficient Implementation of Braid Groups ","ASIACRYPT Theory and Application of Cryptology and Information Security","2","665"
"DeukjoHong;JaechulSung;JonginLim;OkyeonYi;SeokhieHong;WonilLee","Known-IV Attacks on Triple Modes of Operation of Block Ciphers ","ASIACRYPT Theory and Application of Cryptology and Information Security","2","666"
"JaechulSung;JongInLim;SangjoonPark;SeokhieHong","Provable Security for the Skipjack-like Structure against Differential Cryptanalysis and Linear Cryptanalysis ","ASIACRYPT Theory and Application of Cryptology and Information Security","2","667"
"Sang-JoonPark;SeongtaekChee;Sung-MoPark","Conditional Correlation Attack on Nonlinear Filter Generators ","ASIACRYPT Theory and Application of Cryptology and Information Security","2","668"
"JaechulSung;JonginLim;JongsuKim;SeokhieHong","Provable security for round Skipjack-like structure ","Inf Process Lett","2","669"
"KwangjoKim;SeongtaekChee","Semi-bent Functions ","ASIACRYPT Theory and Application of Cryptology and Information Security","2","670"
"DukjaeMoon;JongsungKim;SeokhieHong;SeokwonJung;WonilLee","Amplified Boomerang Attack against Reduced-Round SHACAL ","ASIACRYPT Theory and Application of Cryptology and Information Security","2","671"
"DaikiLee;SeongtaekChee;SooHakSung","On the Correlation Immune Functions and Their Nonlinearity ","ASIACRYPT Theory and Application of Cryptology and Information Security","2","672"
"JaeChoonCha;JaeWooHan;JungHeeCheon;KiHyoungKo","An Efficient Implementation of Braid Groups ","ASIACRYPT Theory and Application of Cryptology and Information Security","2","673"
"DeukjoHong;JaechulSung;JonginLim;OkyeonYi;SeokhieHong;WonilLee","Known-IV Attacks on Triple Modes of Operation of Block Ciphers ","ASIACRYPT Theory and Application of Cryptology and Information Security","2","674"
"JaechulSung;JongInLim;SangjoonPark;SeokhieHong","Provable Security for the Skipjack-like Structure against Differential Cryptanalysis and Linear Cryptanalysis ","ASIACRYPT Theory and Application of Cryptology and Information Security","2","675"
"Sang-JoonPark;SeongtaekChee;Sung-MoPark","Conditional Correlation Attack on Nonlinear Filter Generators ","ASIACRYPT Theory and Application of Cryptology and Information Security","2","676"
"KilsooChun;SeonheeYoon;SeungjooKim;SooHakSung","Differential and linear cryptanalysis for -round SPNs ","Inf Process Lett","2","677"
"JaechulSung;JonginLim;JongsuKim;SeokhieHong","Provable security for round Skipjack-like structure ","Inf Process Lett","2","678"
"KwangjoKim;SooHakSung;Sung-MoPark","Improving Bounds for the Number of Correlation Immune Boolean Functions ","Inf Process Lett","2","679"
"DonghoonChang;JaechulSung;JonginLim;SooHakSung","Full-Round Differential Attack on the Original Version of the Hash Function Proposed at PKC' ","Selected Areas Cryptography","2","680"
"ChoonsikPark;JaeWooHan;Ju-SungKang;JungHeeCheon;KiHyoungKo","New Public-Key Cryptosystem Using Braid Groups ","CRYPTO International Crytology Conference","2","681"
"DeukjoHong;JonginLim;SeokhieHong;YoungdaiKo","Linear Cryptanalysis of SPECTR-H with Higher Order Differential Property ","MMM Multimedia Modeling link ACNS Applied Cryptography and Network Security","2","682"
"DongHyeonCheon;JongInLim;SungJaeLee","New Block Cipher DONUT Using Pairwise Perfect Decorrelation ","INDOCRYPT International Cryptology Conference","2","683"
"DukjaeMoon;JongsungKim;SeokhieHong;SeokwonJung;WonilLee","Amplified Boomerang Attack against Reduced-Round SHACAL ","ASIACRYPT Theory and Application of Cryptology and Information Security","2","684"
"DaikiLee;SeongtaekChee;SooHakSung","On the Correlation Immune Functions and Their Nonlinearity ","ASIACRYPT Theory and Application of Cryptology and Information Security","2","685"
"JaeChoonCha;JaeWooHan;JungHeeCheon;KiHyoungKo","An Efficient Implementation of Braid Groups ","ASIACRYPT Theory and Application of Cryptology and Information Security","2","686"
"DeukjoHong;JaechulSung;JonginLim;OkyeonYi;SeokhieHong;WonilLee","Known-IV Attacks on Triple Modes of Operation of Block Ciphers ","ASIACRYPT Theory and Application of Cryptology and Information Security","2","687"
"JaechulSung;JongInLim;SangjoonPark;SeokhieHong","Provable Security for the Skipjack-like Structure against Differential Cryptanalysis and Linear Cryptanalysis ","ASIACRYPT Theory and Application of Cryptology and Information Security","2","688"
"Sang-JoonPark;SeongtaekChee;Sung-MoPark","Conditional Correlation Attack on Nonlinear Filter Generators ","ASIACRYPT Theory and Application of Cryptology and Information Security","2","689"
"KilsooChun;SeonheeYoon;SeungjooKim;SooHakSung","Differential and linear cryptanalysis for -round SPNs ","Inf Process Lett","2","690"
"JaechulSung;JonginLim;JongsuKim;SeokhieHong","Provable security for round Skipjack-like structure ","Inf Process Lett","2","691"
"KwangjoKim;SooHakSung;Sung-MoPark","Improving Bounds for the Number of Correlation Immune Boolean Functions ","Inf Process Lett","2","692"
"DukjaeMoon;JonginLim;KyungdeokHwang;WonilLee","Impossible Differential Cryptanalysis of Reduced Round XTEA and TEA ","FSE Fast Software Encryption","2","693"
"DeukjoHong;JaechulSung;JonginLim;ShihoMoriai","Impossible Differential Cryptanalysis of Zodiac ","FSE Fast Software Encryption","2","694"
"JonginLim;SangwooPark;SooHakSung","Improving the Upper Bound on the Maximum Differential and the Maximum Linear Hull Probability for SPN Structures and AES ","FSE Fast Software Encryption","2","695"
"JonginLim;KyungdeokHwang;SungjaeLee;WonilLee","Saturation Attacks on Reduced Round Skipjack ","FSE Fast Software Encryption","2","696"
"DonghyeonCheon;InhoCho;JaechulSung;JonginLim;SeokhieHong","Provable Security against Differential and Linear Cryptanalysis for the SPN Structure ","FSE Fast Software Encryption","2","697"
"HyejoungYoo;HyungwooLee;JonginLim","Designated Verification of Non-invertible Watermark ","ISC Information Security Conference","2","698"
"JonginLim;MaengheeSung;SanghoOh;Young-HoPark","An Improved Method of Multiplication on Certain Elliptic Curves ","Public Key Cryptography","2","699"
"ChinHeongKhor","Persistence Framework for Multiple Legacy Databases ","ICEIS International Conference Information Systems","30","700"
"SaiPeckLee;SiewKhimThin;HongSongLiu"," Object-Oriented Manufacturing Application Framework "," Proceedings of th International Conference and Exhibition Technology of Object Oriented Languages and Systems TOOLS","30","701"
"SaiPeckLee;ColetteRoland"," Achieving Reuse via a Generic Model of Reusable Components "," International Journal of Modelling and Simulation ACTA Association Coordination Technique Agricole Association for the Coordination of Agricultural Techniques Press","30","702"
"SaiPeckLee;MZahidurRahman"," A Survey on Electronic Sealed-bid Auction Adoption in Malaysia "," Journal of Electronics and Computer Science","30","703"
"CheeHoongLeong","REPCOM: A Customisable Report Generator Component System Using XML-Driven, Component-Based Development Approach ","ICEIS International Conference Information Systems","30","704"
"CheeHongLeong;SaiPeckLee"," A Report Generator Component System using XML-driven, Component-based Development Approach "," for publication the","30","705"
"Tong-MingLim;Sai-PeckLee"," EOL Database Language For Object Wrapper "," for publication The","30","706"
"TongMingLim;SaiPeckLee"," A Proposed Object Schema Management Tool "," Malaysian Journal of Computer Science","30","707"
"AbdulmajidHissenMohamed;LeeSaiPeck"," A Framework for Collaborative Organizational Learning "," The First International Conference Information and Management Science Xi An","30","708"
"KokMengYew;MZahidurRahman","Formal Verification of Secret Sharing Protocol Using Coq ","ASIAN Asian Computing Science Conference","30","709"
"KokMengYew;MZahidurRahman","Mean Time Offset Protocol for Cluster of Auction Servers over TCP/IP Network ","ICSC International Computing Science Conferences","30","710"
"LipEngYong;SaiPeckLee"," On Languages --- A Reflection "," Special Issue of WSEAS International Editions Books Special Issue of WSEAS Transactions Computers","30","711"
"AbuBakarZaitun;YingWahTeh","Automation Query Processing Selection Algorithms ","ICEIS International Conference Information Systems","30","712"
"MeeYeeChan","Subcube Recognition, Allocation/Deallocation and Relocation in Hypercubes ","SPDP Symposium Parallel and Distributed Processing","31","713"
"MeeYeeChan","Distributed Fault-Tolerant Embeddings of Rings in Hypercubes ","J Parallel Distrib Comput","31","714"
"MeeYeeChan","Fault-Tolerant Permutation Routing in Hypercubes ","J Parallel Distrib Comput","31","715"
"MeeYeeChan","Fault-Tolerant Embedding of Complete Binary Trees in Hypercubes ","IEEE Trans Parallel Distrib Syst","31","716"
"MeeYeeChan","On the Existence of Hamiltonian Circuits in Faulty Hypercubes ","SIAM Society for Industrial and Applied Mathematics J Discrete Math","31","717"
"Ju-YoungLeePark","Contention Free Embedding of Complete Binary Trees into D Meshes in Half and Full-Duplexed Network Models ","ICPP International Conference Parallel Processing","32","718"
"Hyeong-AhChoi;Ju-YoungLeePark","Circuit-Switched Broadcasting in itd-Dimensional Tori and Meshes ","IPPS International Parallel Processing Symposium","32","719"
"Hyeong-AhChoi;Ju-YoungLeePark","Fault-Tolerant Broadcasting in Circuit-Switched Mesh ","PPSC SIAM Conference Parallel Processing for Scientific Computing","32","720"
"Ju-YoungLeePark","Optimal broadcast in /spl alpha/-port wormhole-routed mesh networks ","ICPADS International Conference Parallel and Distributed Systems","32","721"
"Hyeong-AhChoi","Embedding of Complete Binary Trees into Meshes with Row-Column Routing ","IEEE Trans Parallel Distrib Syst","32","722"
"Chang-hoonChoi;Jei-HwanYoo;Jeong-TaekKong;Wong-SeongLee","An efficient statistical analysis methodology and its application to high-density DRAMs ","ICCAD International Conference Computer Aided Design","33","723"
"Chang-hoonChoi;Jin-KyuPark;Kyung-HoKim;Yeong-GilKim","New Model Parameter Extraction Environment for the Submicron Circuit Models ","ISCAS IEEE International Symposium Circuits and Systems","33","724"
"Jai-HoonLee;Kyung-HoKim;Yeong-GilKim","SENSATION: A New Environment for Automatic Circuit Optimization and Statistical Analysis ","ISCAS IEEE International Symposium Circuits and Systems","33","725"
"Chang-hoonChoi;Jin-KyuPark;Kyung-HoKim;Yeong-GilKim","New Model Parameter Extraction Environment for the Submicron Circuit Models ","ISCAS IEEE International Symposium Circuits and Systems","33","726"
"Byung-GookPark;Chun-AnLee;DaeHwanKim;GwanghyeonBaek;JaewooKyung;JongDukLee;Ki-WhanSong;KyungRokKim","Complementary Self-Biased Scheme for the Robust Design of CMOS/SET Hybrid Multi-Valued Logic ","ISMVL IEEE INTERNATIONAL SYMPOSIUM MULTIPLE VALUED LOGIC","33","727"
"Jung-MinChoi;Ki-DongChung;Ki-WanKim","An Alternative Multicast Transmission Scheme for VCR Operations in a Large VOD System ","ICOIN International Conference Information Networking","34","728"
"Ki-DongChung;Si-YongPark","Adaptive Call Admission Control for Mobile Multimedia Network ","IEEE Pacific Rim Conference Multimedia","34","729"
"In-HwanKim;Jeong-WonKim;Ki-DongChung","VBR Video Data Scheduling Using Window-Based Prefetching ","ICMCS International Conference Multimedia Computing and Systems","34","730"
"In-HwanKim;Jung-WonKim;Seung-WonLee;Ki-DongChung"," VBR Video Scheduling using Window-Based Pregeching "," ICMCS International Conference Multimedia Computing and Systems Firenze","34","731"
"In-HwanKim;Jeong-WonKim;Seung-WonLee;Ki-DongChung"," Measurement-Based Adaptive Statistical Admission Control Scheme "," ICOIN International Conference Information Networking Beppu","34","732"
"In-HwanKim;Jeong-WonKim;Ki-DongChung","Measurement-Based Adaptive Statistical Admission Control Scheme for Video-on-Demand Servers ","ICOIN International Conference Information Networking","34","733"
"Seung-WonLee;Ki-WanKim;Jung-MinChoi;Ki-DongChung"," An Alternative Multicast Transmission Scheme for VCR Operations in a Large VOD system "," ICOIN International Conference Information Networking","34","734"
"Seo-LimPark;Seung-WonLee;Ki-DongChung"," Server Switching and Flow Control: Supporting Fault Tolerant Playout of Videos in a VOD System "," ICME","34","735"
"Jung-MinChoi;Seung-WonLee;Ki-DongChung"," A Frame-Based Multicast Transmission FBMT Scheme for Efficient Service in a VOD system "," ICME","34","736"
"Jung-MinChoi;Ki-DongChung","A Multicast Delivery Scheme for VCR Operations in a Large VOD System ","ICPADS International Conference Parallel and Distributed Systems","34","737"
"DanielPFriedman","Enriching the Lambda Calculus with Contexts: Toward a Theory of Incremental Program Construction ","ICFP International Conference Functional Programming","35","738"
"DanielPFriedman","Quasi-Static Scoping: Sharing Variable Bindings Across Multiple Lexical Scopes ","POPL Symposium Principles of Programming Languages","35","739"
"DanielPFriedman","First-Class Extents ","Lisp and Symbolic Computation","35","740"
"DanielPFriedman;StanleyJefferson","A Syntactic Theory of Transparent Parameterization ","ESOP European Symposium Programming","35","741"
"Chul-HeeKang;Dae-gunKim;LynnChoi","Efficient Access Using Hierarchical WML Decks for Multimedia Services under Wireless and Mobile Networks ","MMNS International Conference Management of Multimedia Networks and Services","36","742"
"Chul-HeeKang;Seung-JoonSeok;Sung-HyuckLee","Study of TCP and UDP Flows in a Differentiated Services Network Using Two Markers System ","MMNS International Conference Management of Multimedia Networks and Services","36","743"
"Chul-HeeKang;Seung-JoonSeok;Sung-HyuckLee;Sung-KwanYoum","Two-Differentiated Marking Strategies for TCP Flows in a Differentiated Services Network ","QofIS","36","744"
"Chul-HeeKang;Daeg-gunKim;LynnChoi","Adaptive and Automatic Creation of Hierarchical WML Decks for Efficient Access of Wireless Internet under Wireless Application Protocol ","CDMA Code Division Multiple Access International Conference","36","745"
"Hung-ChangLin;I-ShyanHwang","The O N /  Time Complexity of Fault Diagnosis Algorithm in NxN Dilated Blocking Photonic Switching Networks ","JCIS Joint Conference Information Sciences","37","746"
"I-ShyanHwang;Yi-ShiuLin","The Stochastic Generative Model for Cost Effective OADM Using the Neural Network in WDM Access Networks ","JCIS Joint Conference Information Sciences","37","747"
"I-ShyanHwang","Diagnosing Crosstalk Faults in a Class of Dilated Blocking Optical Multistage Interconnection Networks ","ICDCS International Conference Distributed Computing Systems Workshop Distributed System Validation and Verification","37","748"
"I-ShyanHwang","Diagnosing crosstalk faults in a class of dilated blocking optical multistage interconnection networks ","Inf Sci","37","749"
"Bo-YeongKang;Dae-WonKim;Sang-OkGu","Combining Semantic Based Indexing and Fuzzy Relevance Model in IR System ","FSKD Fuzzy Systems and Knowledge Discovery","38","750"
"Bo-YeongKang;Jung-HeePark;Tae-GilNoh","A Semantic Approach to Index Term Weighting ","IC AI Artificial Intelligence","38","751"
"MuHeeSong;SangOkKoo;SooYeonLim","Hub Word Based Ontology Construction for Document Retrieval ","IC AI Artificial Intelligence","38","752"
"Bo-YeongKang","On Concept Based Approach for Determining Semantic Index Terms ","TSD Temporal Logic Specification","38","753"
